<!ELEMENT products (product+)>

<!ELEMENT product (name, description, price, category)>

<!ELEMENT name (#PCDATA)>
<!ELEMENT description (#PCDATA)>
<!ELEMENT price (#PCDATA)>
<!ELEMENT category (#PCDATA)>

<!ATTLIST product id ID #REQUIRED>